{
  "key": "webhooks",
  "kind": "plugin",
  "package": "@meith/plugin-webhooks",
  "name": "Webhooks",
  "description": "New threads and posts delivered to an endpoint of your choosing, with a Discord-compatible preset.",
  "screenshots": ["webhooks-light.png"],
  "version": "0.23.2",
  "apiVersion": 0,
  "meith": ">=0.16 <1",
  "repository": "https://github.com/meith-dev/meith",
  "licence": "MIT"
}
