{
  "key": "calendar",
  "kind": "plugin",
  "package": "@meith/plugin-calendar",
  "name": "Calendar",
  "description": "A shared calendar: events the community can see, linked to the threads that discuss them.",
  "screenshots": ["calendar-light.png"],
  "version": "0.38.0",
  "apiVersion": 0,
  "meith": ">=0.16 <1",
  "repository": "https://github.com/meith-dev/meith",
  "licence": "MIT"
}
