{
  "key": "default",
  "kind": "theme",
  "package": "@meith/theme-default",
  "name": "Default",
  "description": "Meith's default theme — every slot and every token, and the reference for what a complete theme fills.",
  "screenshots": ["default-light.png"],
  "version": "0.38.0",
  "apiVersion": 0,
  "meith": ">=0.16 <1",
  "repository": "https://github.com/meith-dev/meith",
  "licence": "MIT"
}
