{
  "key": "awards",
  "kind": "plugin",
  "package": "@meith/plugin-awards",
  "name": "Awards",
  "description": "Community awards, manual recognition and achievements.",
  "screenshots": ["awards-light.png"],
  "version": "0.38.0",
  "apiVersion": 0,
  "meith": ">=0.16 <1",
  "repository": "https://github.com/meith-dev/meith",
  "licence": "MIT"
}
